{
  "apiVersion": "sbomer.jboss.org/v1alpha1",
  "buildId": "A3YCIKLQTVYAA",
  "environment": {
    "gradle": "5.6.2",
    "java": "8",
    "maven": "3.6.0"
  },
  "products": [
    {
      "processors": [
        {
          "type": "redhat-product",
          "errata": {
            "productName": "RHTESTPRODUCT",
            "productVersion": "RHEL-8-RHTESTPRODUCT-1.1",
            "productVariant": "8Base-RHTESTPRODUCT-1.1"
          }
        }
      ],
      "generator": {
        "type": "gradle-cyclonedx",
        "version": "1.7.3"
      }
    }
  ]
}
